{
  "name": "agents-system-setup",
  "version": "1.15.0",
  "description": "Bootstrap, update, improve, or replicate multi-agent systems across Copilot CLI, Claude Code, OpenCode, OpenAI Codex, and Gemini CLI artifacts. Encourages parallel subagents and Claude Code agent teams.",
  "author": {
    "name": "ytthuan",
    "url": "https://github.com/ytthuan"
  },
  "homepage": "https://github.com/ytthuan/agents-system-setup",
  "repository": "https://github.com/ytthuan/agents-system-setup",
  "license": "MIT",
  "keywords": [
    "agents",
    "claude-code",
    "gemini-cli",
    "subagents",
    "agent-teams",
    "scaffolding",
    "mcp",
    "replication"
  ],
  "skills": [
    "./skills/agents-system-setup"
  ]
}
